{
  "$schema": "./panes.schema.json",
  "schema": "saasreport.admin-panes.v1",
  "title": "SaasReport admin",
  "intro": "Type a command, or open a tab. Every pane reads the admin API and says so; changes (lead status, retries, suppressions) are made through the API, and every one is written to the audit log.",
  "licence": "Private to the owner. Read through Cloudflare Access; nothing here may be copied out.",
  "layouts": [
    {
      "id": "users",
      "title": "User management",
      "groups": [
        [
          "users",
          "roles"
        ],
        [
          "invitations",
          "audit"
        ]
      ]
    },
    {
      "id": "finops-bizops",
      "title": "FinOps and BizOps",
      "groups": [
        [
          "finops"
        ],
        [
          "bizops",
          "funnel"
        ]
      ]
    },
    {
      "id": "platform-saas-infra",
      "title": "Platform, SaaS and Infra",
      "groups": [
        [
          "platformops",
          "saasops"
        ],
        [
          "infraops",
          "workers"
        ]
      ]
    },
    {
      "id": "inbox",
      "title": "Leads and deliveries",
      "groups": [
        [
          "leads",
          "funnel"
        ],
        [
          "deliveries",
          "deliveries-summary",
          "alerts"
        ]
      ]
    },
    {
      "id": "mail",
      "title": "Mail",
      "groups": [
        [
          "inbound",
          "autoreply"
        ],
        [
          "suppressions",
          "receipts"
        ]
      ]
    },
    {
      "id": "registries",
      "title": "Registries",
      "groups": [
        [
          "stakeholders",
          "metrics",
          "report-types"
        ],
        [
          "findings",
          "commitments",
          "legal"
        ]
      ]
    },
    {
      "id": "operations",
      "title": "Operations",
      "groups": [
        [
          "workers",
          "audit"
        ],
        [
          "provisioning-config",
          "provisioning-bindings",
          "provisioning-planned"
        ]
      ]
    }
  ],
  "defaultLayout": "finops-bizops",
  "panes": [
    {
      "id": "workers",
      "operation": "getOverview",
      "rows": "/workers",
      "title": "Workers",
      "summary": "Every Worker's /api/build: the commit it serves, and whether it is main's head.",
      "empty": "No Worker answered.",
      "command": {
        "verb": "WORKERS",
        "aliases": [
          "health",
          "builds"
        ],
        "summary": "Health and commit of every Worker",
        "args": []
      },
      "columns": [
        {
          "key": "id",
          "label": "Worker"
        },
        {
          "key": "via",
          "label": "Reached by"
        },
        {
          "key": "reachable",
          "label": "Reachable",
          "type": "bool"
        },
        {
          "key": "commit",
          "label": "Commit"
        },
        {
          "key": "matches_main",
          "label": "Is main's head",
          "type": "bool"
        },
        {
          "key": "error",
          "label": "Error"
        }
      ]
    },
    {
      "id": "funnel",
      "operation": "getOverview",
      "rows": "/leads/by_status",
      "keyed": true,
      "title": "Lead funnel",
      "summary": "Leads by status.",
      "empty": "No leads yet.",
      "command": {
        "verb": "FUNNEL",
        "aliases": [
          "pipeline"
        ],
        "summary": "Leads by status",
        "args": []
      },
      "columns": [
        {
          "key": "key",
          "label": "Status"
        },
        {
          "key": "value",
          "label": "Leads",
          "type": "number"
        }
      ]
    },
    {
      "id": "deliveries-summary",
      "operation": "getOverview",
      "rows": "/deliveries",
      "keyed": true,
      "title": "Delivery summary",
      "summary": "The counts the monitor reads over the last day.",
      "empty": "The delivery ledger is not available.",
      "command": {
        "verb": "DSUM",
        "aliases": [
          "summary"
        ],
        "summary": "Delivery counts over the last day",
        "args": []
      },
      "columns": [
        {
          "key": "key",
          "label": "Count"
        },
        {
          "key": "value",
          "label": "Value"
        }
      ]
    },
    {
      "id": "leads",
      "operation": "listLeads",
      "rows": "/items",
      "title": "Leads",
      "summary": "Newest first. Open a lead, set its status or export the list through the API (getLead, updateLead, exportLeads).",
      "empty": "No lead matches.",
      "command": {
        "verb": "LEADS",
        "aliases": [
          "lead"
        ],
        "summary": "Leads, filtered by status, form or name",
        "args": [
          {
            "param": "status",
            "hint": "new, contacted, qualified, won or lost"
          },
          {
            "param": "form",
            "hint": "a form id"
          },
          {
            "param": "q",
            "hint": "part of a name or company"
          }
        ],
        "example": "LEADS new"
      },
      "columns": [
        {
          "key": "created_at",
          "label": "Received",
          "type": "date"
        },
        {
          "key": "name",
          "label": "Name"
        },
        {
          "key": "company",
          "label": "Company"
        },
        {
          "key": "form",
          "label": "Form"
        },
        {
          "key": "status",
          "label": "Status"
        },
        {
          "key": "comms_status",
          "label": "Autoreply"
        },
        {
          "key": "id",
          "label": "Reference"
        }
      ]
    },
    {
      "id": "deliveries",
      "operation": "listDeliveries",
      "rows": "/items",
      "title": "Form deliveries",
      "summary": "The receipt and the owner's notification of every submission. A failed one is retried through the comms engine (retryDelivery).",
      "empty": "No delivery matches.",
      "command": {
        "verb": "DELIV",
        "aliases": [
          "deliveries",
          "ledger"
        ],
        "summary": "The form delivery ledger",
        "args": [
          {
            "param": "state",
            "hint": "all, failed or pending"
          },
          {
            "param": "form_id",
            "hint": "a form id"
          }
        ],
        "example": "DELIV failed"
      },
      "columns": [
        {
          "key": "created_at",
          "label": "Received",
          "type": "date"
        },
        {
          "key": "reference",
          "label": "Reference"
        },
        {
          "key": "form_id",
          "label": "Form"
        },
        {
          "key": "receipt.status",
          "label": "Receipt"
        },
        {
          "key": "owner.status",
          "label": "Owner"
        },
        {
          "key": "owner.error",
          "label": "Owner error"
        }
      ]
    },
    {
      "id": "alerts",
      "operation": "listOwnerAlertFailures",
      "rows": "/failures",
      "title": "Owner-alert failures",
      "summary": "Owner notifications that failed or are still pending, and failed operator dispatches.",
      "empty": "No owner alert has failed in the window.",
      "command": {
        "verb": "ALERTS",
        "aliases": [
          "failures"
        ],
        "summary": "Owner-alert failures",
        "args": [
          {
            "param": "window_hours",
            "hint": "hours to look back"
          }
        ],
        "example": "ALERTS 24"
      },
      "columns": [
        {
          "key": "at",
          "label": "When",
          "type": "date"
        },
        {
          "key": "kind",
          "label": "Kind"
        },
        {
          "key": "id",
          "label": "Reference"
        },
        {
          "key": "form_id",
          "label": "Form"
        },
        {
          "key": "status",
          "label": "Status"
        },
        {
          "key": "error",
          "label": "Error"
        }
      ]
    },
    {
      "id": "inbound",
      "operation": "listInbound",
      "rows": "/items",
      "title": "Inbound mail",
      "summary": "Sender as the hash the table stores, the receiving mailbox, the forward per destination and the autoreply state.",
      "empty": "No inbound message, or the inbound table is not deployed yet.",
      "command": {
        "verb": "INBOX",
        "aliases": [
          "inbound",
          "mail"
        ],
        "summary": "Inbound messages",
        "args": [
          {
            "param": "status",
            "hint": "received, forwarded, partial, failed, rejected or dropped"
          }
        ],
        "example": "INBOX failed"
      },
      "columns": [
        {
          "key": "received_at",
          "label": "Received",
          "type": "date"
        },
        {
          "key": "recipient",
          "label": "Mailbox"
        },
        {
          "key": "status",
          "label": "Status"
        },
        {
          "key": "forwards",
          "label": "Forwards"
        },
        {
          "key": "autoreply.state",
          "label": "Autoreply"
        },
        {
          "key": "sender_hash",
          "label": "Sender (hash)"
        }
      ]
    },
    {
      "id": "autoreply",
      "operation": "getAutoreplyStats",
      "rows": "/inbound/by_state",
      "keyed": true,
      "title": "Autoreplies",
      "summary": "Inbound autoreplies by state over the window.",
      "empty": "No autoreply in the window, or the inbound table is not deployed yet.",
      "command": {
        "verb": "REPLY",
        "aliases": [
          "autoreply"
        ],
        "summary": "Autoreply statistics",
        "args": [
          {
            "param": "window_hours",